Qid,Question,Option 1,Option 2,Option 3,Option 4,Answer
1,What is the largest organ in the human body?, Liver,Brain,Skin,Heart,Skin
2,"Who is known as the ""Father of Evolution""?",Charles Darwin,Isaac Newton,Albert Einstein,Leonardo da Vinci,Charles Darwin
3,What is the chemical symbol for gold?,Ag, Au,Fe,Pb,Au
4,What is the tallest mountain in the world?,Mount Kilimanjaro,Mount Everest,Mount McKinley,Mount Fuji, Mount Everest
5,Who painted the Mona Lisa?,Vincent van Gogh,Pablo Picasso, Leonardo da Vinci,Salvador Dalí,Leonardo da Vinci
6,What is the unit of electric current?,Volt,Watt,Ampere,Ohm, Ampere
7,What is the chemical formula for water?,NaCl, CO2,H2O, O2,H2O
